{
  "name": "git-worktree",
  "version": "1.0.0",
  "stage": "requirement",
  "description": "基于用户需求创建 git 分支与工作树：从用户原始提示词提取关键词生成分支名，创建工作树目录（即本次 run 的运行目录），将后续流水线的工作目录切换到该工作树，并刷写 context 阶段的延迟产物到 worktree。",
  "enabled": true,
  "io": {
    "inputs": [
      { "ref": "skill://atom-tasks/git-worktree/branch-rules.json", "required": true },
      { "ref": "skill://config.json", "required": true }
    ],
    "outputs": [
      { "ref": "run://docs/{type}/worktree-info.json", "kind": "json" }
    ]
  },
  "prompt": {
    "instruction": "1. Read skill://atom-tasks/git-worktree/branch-rules.json to get the branch naming template and config.\n2. Read skill://config.json to get the base.targetDir setting.\n3. Extract a description slug from the user's original prompt (the message that triggered this skill). Take the first meaningful sentence or phrase (skip activation keywords like 'use ddo-code-flow'), convert to kebab-case: lowercase, strip special chars, collapse whitespace to hyphens. Truncate to 50 chars. If extraction fails, use branch-rules.json defaults.descriptionFallback.\n4. Generate the branch name by substituting placeholders in the template: {prefix} → defaults.prefix, {date} → today's date (YYYY-MM-DD), {description} → the extracted slug. Join with defaults.separator. Truncate the final name to defaults.maxBranchNameLength. Record the {prefix} value as 'type' (e.g. feat, fix, chore, docs, refactor, test, perf, ci, build).\n5. Compute the worktree path: resolve base.targetDir relative to the project root, then append the branch name as a subdirectory. For example, if targetDir is '..' and branch is 'feat/2026-06-24-add-dark-mode', the worktree path is '../feat/2026-06-24-add-dark-mode' (sibling of project root).\n6. If reuseExisting is true, check if a worktree for this branch already exists via 'git worktree list'. If found, reuse it — write worktree-info.json and update .state.json with the existing worktree path.\n7. Otherwise, create the branch and worktree:\n   a. Run 'git branch <branch-name>' from baseRef. If the branch already exists, append -2, -3, ... until unique.\n   b. Run 'git worktree add <worktree-path> <branch-name>' where worktree-path is the computed path under targetDir.\n   c. Verify the command succeeded (exit code 0 and the directory exists).\n8. Create the docs subdirectory: mkdir -p <worktree-path>/docs/<type>/ (where <type> is the branch prefix from step 4). All subsequent MD artifacts will be written under this directory.\n9. Write run://docs/{type}/worktree-info.json with: { branchName, worktreePath (absolute), targetDir, type, baseRef, createdAt (ISO 8601) }.\n10. Write .state.json to run://docs/{type}/.state.json: set the top-level field 'worktreePath' to the absolute worktree path, and set 'type' to the branch prefix. This causes all subsequent stages to resolve run:// paths relative to the worktree, and run://docs/{type}/ paths to the docs subdirectory.",
    "guardrails": [
      "Never modify any files in the main working tree; only operate on the new worktree.",
      "Always verify 'git worktree add' succeeds (exit code 0) before proceeding.",
      "If git commands fail (not a git repo, dirty worktree, etc.), halt and report the error — do not continue the pipeline.",
      "Do not delete or move existing worktrees unless reuseExisting is true and the worktree matches the target branch.",
      "The worktreePath in worktree-info.json MUST be an absolute path.",
      "The docs/<type>/ subdirectory MUST be created immediately after the worktree, where <type> is the branch prefix (feat/fix/chore/...). All subsequent MD artifacts are written there."
    ]
  },
  "confirmation": {
    "required": false,
    "rejectAction": "abort"
  },
  "concurrency": { "parallelizable": false },
  "timeoutSec": 60
}
