{
  "name": "reporting",
  "version": "1.0.0",
  "stage": "reporting",
  "description": "汇总各阶段产物与 Verification 结果，生成 execution-report.md，引用 spec / plan / test-plan 三份核心文档与本次 run 的关键事件。",
  "enabled": true,
  "io": {
    "inputs": [
      { "ref": "skill://atom-tasks/reporting/execution-report_template.md", "required": true },
      { "ref": "run://docs/{type}/{dateDescription}/.state.json", "required": true },
      { "ref": "run://docs/{type}/{dateDescription}/verification.log", "required": false },
      { "ref": "run://docs/{type}/{dateDescription}/spec.md", "required": false },
      { "ref": "run://docs/{type}/{dateDescription}/plan.md", "required": false },
      { "ref": "run://docs/{type}/{dateDescription}/test-plan.md", "required": false }
    ],
    "outputs": [
      { "ref": "run://docs/{type}/{dateDescription}/execution-report.md", "kind": "markdown" }
    ]
  },
  "prompt": {
    "instruction": "Fill execution-report_template.md with: (a) run metadata from .state.json (runId, createdAt, currentStage, history); (b) per-stage artifact list from .state.json.stages[*].outputs; (c) verification summary derived from verification.log (count pass/fail); (d) 'Context missing' list from context-summary.md if present; (e) explicit links to spec.md, plan.md, test-plan.md.",
    "templateRef": "skill://atom-tasks/reporting/execution-report_template.md",
    "guardrails": [
      "Do not invent stages that .state.json does not contain.",
      "Quote .state.json.history entries verbatim under 'Decisions log'.",
      "If verification.log is missing, write 'Verification not run' in that section."
    ]
  },
  "confirmation": {
    "required": false,
    "rejectAction": "regenerate-with-feedback"
  },
  "concurrency": { "parallelizable": false },
  "timeoutSec": 0
}
